{
  "schema_version": "0.1",
  "job_id": "delivery-clean",
  "asset": {
    "path": "C:\\Users\\Administrator\\Desktop\\Agent infra\\Agent比赛\\Agent比赛\\sceneguard\\jobs\\delivery-clean\\working\\candidate.glb",
    "sha256": "46f324f7c888b2f9ad5ec5aa1144e10814d183b9abecf6d2d342c0bc4153cb59"
  },
  "profile": {
    "id": "web-realtime",
    "version": "0.2"
  },
  "measurements": {
    "file_bytes": 656,
    "bin_bytes": 44,
    "scene_count": 1,
    "node_count": 1,
    "mesh_count": 1,
    "primitive_count": 1,
    "material_count": 0,
    "texture_count": 0,
    "image_count": 0,
    "degenerate_triangle_count": 0,
    "non_finite_position_count": 0,
    "triangle_count": 1,
    "embedded_image_dimensions": [],
    "max_texture_dimension": 0
  },
  "findings": [],
  "checks_completed": [
    "package.valid_glb",
    "package.single_file",
    "package.bounds",
    "package.references",
    "mesh.geometry",
    "profile.budgets"
  ],
  "checks_incomplete": [],
  "summary": {
    "gate_state": "PASS",
    "error_count": 0,
    "warning_count": 0
  },
  "created_at": "2026-08-06T08:29:29.120299+00:00"
}
