{
  "schema_version": "0.1",
  "job_id": "delivery-repair",
  "asset": {
    "path": "C:\\Users\\Administrator\\Desktop\\Agent infra\\Agent比赛\\Agent比赛\\sceneguard\\jobs\\delivery-repair\\working\\candidate.glb",
    "sha256": "fe504e9b7676ae389d1a2c4fc3d233ead84ca66422f3f7ff792969808040648b"
  },
  "profile": {
    "id": "web-realtime",
    "version": "0.2"
  },
  "measurements": {
    "file_bytes": 656,
    "bin_bytes": 44,
    "scene_count": 1,
    "node_count": 1,
    "mesh_count": 1,
    "primitive_count": 1,
    "material_count": 0,
    "texture_count": 0,
    "image_count": 0,
    "degenerate_triangle_count": 1,
    "non_finite_position_count": 0,
    "triangle_count": 1,
    "embedded_image_dimensions": [],
    "max_texture_dimension": 0
  },
  "findings": [
    {
      "finding_id": "f-0001",
      "rule_id": "mesh.degenerate_triangles",
      "severity": "ERROR",
      "message": "mesh contains zero-area or repeated-index triangles",
      "location": {},
      "observed": 1,
      "expected": 0,
      "evidence": {
        "locations": [
          {
            "mesh": 0,
            "primitive": 0,
            "triangle": 0
          }
        ]
      },
      "repairability": "AUTO_CANDIDATE",
      "confidence": 1.0
    }
  ],
  "checks_completed": [
    "package.valid_glb",
    "package.single_file",
    "package.bounds",
    "package.references",
    "mesh.geometry",
    "profile.budgets"
  ],
  "checks_incomplete": [],
  "summary": {
    "gate_state": "REJECTED",
    "error_count": 1,
    "warning_count": 0
  },
  "created_at": "2026-08-06T08:29:29.229186+00:00"
}
